### ISSUE TITLE
generating multiple events successively fails

### ISSUE THREAD

**Issue by sqadasi** [open62541/open62541#2114]
Description
===========
Hello everyone!
I've tried to generate multiple events successively in a loop using the events tutorial:
```
static UA_StatusCode
generateEventMethodCallback(UA_Server *server,
                         const UA_NodeId *sessionId, void *sessionHandle,
                         const UA_NodeId *methodId, void *methodContext,
                         const UA_NodeId *objectId, void *objectContext,
                         size_t inputSize, const UA_Variant *input,
                         size_t outputSize, UA_Variant *output) {

    UA_LOG_INFO(UA_Log_Stdout, UA_LOGCATEGORY_USERLAND, "Creating event");

    /* set up event */
	for(size_t i=0; (i<5)&&(retval==UA_STATUSCODE_GOOD); i++) {
	  UA_NodeId eventNodeId;
	  UA_StatusCode retval = setUpEvent(server, &eventNodeId);
	  if(retval != UA_STATUSCODE_GOOD) {
	  UA_LOG_WARNING(UA_Log_Stdout, UA_LOGCATEGORY_USERLAND,
		  			  "Creating event failed. StatusCode %s", UA_StatusCode_name(retval));
	  return retval;
	  }

	retval = UA_Server_triggerEvent(server, eventNodeId, UA_NODEID_NUMERIC(0, UA_NS0ID_SERVER), NULL, UA_TRUE);
	if(retval != UA_STATUSCODE_GOOD)
		UA_LOG_WARNING(UA_Log_Stdout, UA_LOGCATEGORY_USERLAND, 
						  "Triggering event failed. StatusCode %s", UA_StatusCode_name(retval));
	}
    return retval;
}
```

however, I've faced two problems:
1) only the first event doesn't show normal field values. Other Events are ok.
![event_error](https://user-images.githubusercontent.com/26954301/46962803-59867c80-d0a4-11e8-9465-3d04f3683add.JPG)

2) when generating the events for the second time, or when trying to set event filter with UaExpert, then the server crashes. The assert check fails at: https://github.com/open62541/open62541/blob/271c944049d0b33435f43ced139f5d76fcafadc3/src/server/ua_subscription_monitoreditem.c#L273

I couldn't find the root of the problem, so your help is appreciated :)

Background Information / Reproduction Steps
===========================================

Checklist
=========
Please provide the following information:

 - [x] open62541 Version (release number or git tag): 271c944049d0b33435f43ced139f5d76fcafadc3
 - [ ] Other OPC UA SDKs used (client or server): 
 - [ ] Operating system:
 - [ ] Logs (with `UA_LOGLEVEL` set as low as necessary) attached
 - [ ] Wireshark network dump attached
 - [ ] Self-contained code example attached
 - [ ] Critical issue

**Comment by aDogCalledSpot** [comment]
Unfortunately, I'm unable to reproduce these issues locally, could you maybe provide a Wireshark log where you connect, create the monitored item, call the method and then either modify the filter or call it again (perhaps both would be best) and then I can try finding out what's going on.

**Comment by sqadasi** [comment]
@aDogCalledSpot thank you for responding!
I hope those are logs which you need:

1) Open SecureChannelResponse
```
Frame 148: 189 bytes on wire (1512 bits), 189 bytes captured (1512 bits) on interface 0
    Interface id: 0 (\Device\NPF_{5295E406-3F56-45E1-9A83-302580141ACC})
        Interface name: \Device\NPF_{5295E406-3F56-45E1-9A83-302580141ACC}
    Encapsulation type: Ethernet (1)
    Arrival Time: Oct 16, 2018 11:35:08.615306000 Mitteleuropäische Sommerzeit
    [Time shift for this packet: 0.000000000 seconds]
    Epoch Time: 1539682508.615306000 seconds
    [Time delta from previous captured frame: 0.019707000 seconds]
    [Time delta from previous displayed frame: 0.019707000 seconds]
    [Time since reference or first frame: 40.142613000 seconds]
    Frame Number: 148
    Frame Length: 189 bytes (1512 bits)
    Capture Length: 189 bytes (1512 bits)
    [Frame is marked: False]
    [Frame is ignored: False]
    [Protocols in frame: eth:ethertype:ip:tcp:opcua]
    [Coloring Rule Name: TCP]
    [Coloring Rule String: tcp]
Ethernet II, Src: Hilscher_2c:b7:3d (00:02:a2:2c:b7:3d), Dst: Luxshare_0e:ee:05 (3c:18:a0:0e:ee:05)
    Destination: Luxshare_0e:ee:05 (3c:18:a0:0e:ee:05)
        Address: Luxshare_0e:ee:05 (3c:18:a0:0e:ee:05)
        .... ..0. .... .... .... .... = LG bit: Globally unique address (factory default)
        .... ...0 .... .... .... .... = IG bit: Individual address (unicast)
    Source: Hilscher_2c:b7:3d (00:02:a2:2c:b7:3d)
        Address: Hilscher_2c:b7:3d (00:02:a2:2c:b7:3d)
        .... ..0. .... .... .... .... = LG bit: Globally unique address (factory default)
        .... ...0 .... .... .... .... = IG bit: Individual address (unicast)
    Type: IPv4 (0x0800)
Internet Protocol Version 4, Src: 192.168.0.20, Dst: 192.168.0.10
    0100 .... = Version: 4
    .... 0101 = Header Length: 20 bytes (5)
    Differentiated Services Field: 0x00 (DSCP: CS0, ECN: Not-ECT)
        0000 00.. = Differentiated Services Codepoint: Default (0)
        .... ..00 = Explicit Congestion Notification: Not ECN-Capable Transport (0)
    Total Length: 175
    Identification: 0x000a (10)
    Flags: 0x0000
        0... .... .... .... = Reserved bit: Not set
        .0.. .... .... .... = Don't fragment: Not set
        ..0. .... .... .... = More fragments: Not set
        ...0 0000 0000 0000 = Fragment offset: 0
    Time to live: 64
    Protocol: TCP (6)
    Header checksum: 0xf8d0 [validation disabled]
    [Header checksum status: Unverified]
    Source: 192.168.0.20
    Destination: 192.168.0.10
Transmission Control Protocol, Src Port: 4840, Dst Port: 52077, Seq: 29, Ack: 194, Len: 135
    Source Port: 4840
    Destination Port: 52077
    [Stream index: 1]
    [TCP Segment Len: 135]
    Sequence number: 29    (relative sequence number)
    [Next sequence number: 164    (relative sequence number)]
    Acknowledgment number: 194    (relative ack number)
    0101 .... = Header Length: 20 bytes (5)
    Flags: 0x018 (PSH, ACK)
        000. .... .... = Reserved: Not set
        ...0 .... .... = Nonce: Not set
        .... 0... .... = Congestion Window Reduced (CWR): Not set
        .... .0.. .... = ECN-Echo: Not set
        .... ..0. .... = Urgent: Not set
        .... ...1 .... = Acknowledgment: Set
        .... .... 1... = Push: Set
        .... .... .0.. = Reset: Not set
        .... .... ..0. = Syn: Not set
        .... .... ...0 = Fin: Not set
        [TCP Flags: ·······AP···]
    Window size value: 2048
    [Calculated window size: 2048]
    [Window size scaling factor: -2 (no window scaling used)]
    Checksum: 0xa6a6 [unverified]
    [Checksum Status: Unverified]
    Urgent pointer: 0
    [SEQ/ACK analysis]
        [This is an ACK to the segment in frame: 147]
        [The RTT to ACK the segment was: 0.019707000 seconds]
        [iRTT: 0.001521000 seconds]
        [Bytes in flight: 135]
        [Bytes sent since last PSH flag: 135]
    [Timestamps]
        [Time since first frame in this TCP stream: 0.035743000 seconds]
        [Time since previous frame in this TCP stream: 0.019707000 seconds]
    TCP payload (135 bytes)
    [PDU Size: 135]
OpcUa Binary Protocol
    Message Type: OPN
    Chunk Type: F
    Message Size: 135
    SecureChannelId: 2
    SecurityPolicyUri: http://opcfoundation.org/UA/SecurityPolicy#None
    SenderCertificate: <MISSING>[OpcUa Null ByteString]
    ReceiverCertificateThumbprint: <MISSING>[OpcUa Null ByteString]
    SequenceNumber: 1
    RequestId: 1
    Message : Encodeable Object
        TypeId : ExpandedNodeId
            NodeId EncodingMask: Four byte encoded Numeric (0x01)
            NodeId Namespace Index: 0
            NodeId Identifier Numeric: OpenSecureChannelResponse (449)
        OpenSecureChannelResponse
            ResponseHeader: ResponseHeader
                Timestamp: Oct 16, 2018 11:35:09.095000000 Mitteleuropäische Sommerzeit
                RequestHandle: 0
                ServiceResult: 0x00000000 [Good]
                ServiceDiagnostics: DiagnosticInfo
                    EncodingMask: 0x00
                        .... ...0 = has symbolic id: False
                        .... ..0. = has namespace: False
                        .... .0.. = has localizedtext: False
                        .... 0... = has locale: False
                        ...0 .... = has additional info: False
                        ..0. .... = has inner statuscode: False
                        .0.. .... = has inner diagnostic info: False
                StringTable: Array of String
                    ArraySize: -1
                AdditionalHeader: ExtensionObject
                    TypeId: ExpandedNodeId
                        EncodingMask: 0x00, EncodingMask: Two byte encoded Numeric
                            .... 0000 = EncodingMask: Two byte encoded Numeric (0x0)
                            .0.. .... = has server index: False
                            0... .... = has namespace uri: False
                        Identifier Numeric: 0
                    EncodingMask: 0x00
                        .... ...0 = has binary body: False
                        .... ..0. = has xml body: False
            ServerProtocolVersion: 0
            SecurityToken: ChannelSecurityToken
                ChannelId: 2
                TokenId: 2
                CreatedAt: Oct 16, 2018 11:35:09.093000000 Mitteleuropäische Sommerzeit
                RevisedLifetime: 600000
            ServerNonce: <MISSING>[OpcUa Null ByteString]

```

2) CreateSessionResponse
```
Frame 150: 580 bytes on wire (4640 bits), 580 bytes captured (4640 bits) on interface 0
    Interface id: 0 (\Device\NPF_{5295E406-3F56-45E1-9A83-302580141ACC})
        Interface name: \Device\NPF_{5295E406-3F56-45E1-9A83-302580141ACC}
    Encapsulation type: Ethernet (1)
    Arrival Time: Oct 16, 2018 11:35:08.635512000 Mitteleuropäische Sommerzeit
    [Time shift for this packet: 0.000000000 seconds]
    Epoch Time: 1539682508.635512000 seconds
    [Time delta from previous captured frame: 0.019975000 seconds]
    [Time delta from previous displayed frame: 0.019975000 seconds]
    [Time since reference or first frame: 40.162819000 seconds]
    Frame Number: 150
    Frame Length: 580 bytes (4640 bits)
    Capture Length: 580 bytes (4640 bits)
    [Frame is marked: False]
    [Frame is ignored: False]
    [Protocols in frame: eth:ethertype:ip:tcp:opcua]
    [Coloring Rule Name: TCP]
    [Coloring Rule String: tcp]
Ethernet II, Src: Hilscher_2c:b7:3d (00:02:a2:2c:b7:3d), Dst: Luxshare_0e:ee:05 (3c:18:a0:0e:ee:05)
    Destination: Luxshare_0e:ee:05 (3c:18:a0:0e:ee:05)
        Address: Luxshare_0e:ee:05 (3c:18:a0:0e:ee:05)
        .... ..0. .... .... .... .... = LG bit: Globally unique address (factory default)
        .... ...0 .... .... .... .... = IG bit: Individual address (unicast)
    Source: Hilscher_2c:b7:3d (00:02:a2:2c:b7:3d)
        Address: Hilscher_2c:b7:3d (00:02:a2:2c:b7:3d)
        .... ..0. .... .... .... .... = LG bit: Globally unique address (factory default)
        .... ...0 .... .... .... .... = IG bit: Individual address (unicast)
    Type: IPv4 (0x0800)
Internet Protocol Version 4, Src: 192.168.0.20, Dst: 192.168.0.10
    0100 .... = Version: 4
    .... 0101 = Header Length: 20 bytes (5)
    Differentiated Services Field: 0x00 (DSCP: CS0, ECN: Not-ECT)
        0000 00.. = Differentiated Services Codepoint: Default (0)
        .... ..00 = Explicit Congestion Notification: Not ECN-Capable Transport (0)
    Total Length: 566
    Identification: 0x000b (11)
    Flags: 0x0000
        0... .... .... .... = Reserved bit: Not set
        .0.. .... .... .... = Don't fragment: Not set
        ..0. .... .... .... = More fragments: Not set
        ...0 0000 0000 0000 = Fragment offset: 0
    Time to live: 64
    Protocol: TCP (6)
    Header checksum: 0xf748 [validation disabled]
    [Header checksum status: Unverified]
    Source: 192.168.0.20
    Destination: 192.168.0.10
Transmission Control Protocol, Src Port: 4840, Dst Port: 52077, Seq: 164, Ack: 526, Len: 526
    Source Port: 4840
    Destination Port: 52077
    [Stream index: 1]
    [TCP Segment Len: 526]
    Sequence number: 164    (relative sequence number)
    [Next sequence number: 690    (relative sequence number)]
    Acknowledgment number: 526    (relative ack number)
    0101 .... = Header Length: 20 bytes (5)
    Flags: 0x018 (PSH, ACK)
        000. .... .... = Reserved: Not set
        ...0 .... .... = Nonce: Not set
        .... 0... .... = Congestion Window Reduced (CWR): Not set
        .... .0.. .... = ECN-Echo: Not set
        .... ..0. .... = Urgent: Not set
        .... ...1 .... = Acknowledgment: Set
        .... .... 1... = Push: Set
        .... .... .0.. = Reset: Not set
        .... .... ..0. = Syn: Not set
        .... .... ...0 = Fin: Not set
        [TCP Flags: ·······AP···]
    Window size value: 2048
    [Calculated window size: 2048]
    [Window size scaling factor: -2 (no window scaling used)]
    Checksum: 0x473e [unverified]
    [Checksum Status: Unverified]
    Urgent pointer: 0
    [SEQ/ACK analysis]
        [This is an ACK to the segment in frame: 149]
        [The RTT to ACK the segment was: 0.019975000 seconds]
        [iRTT: 0.001521000 seconds]
        [Bytes in flight: 526]
        [Bytes sent since last PSH flag: 526]
    [Timestamps]
        [Time since first frame in this TCP stream: 0.055949000 seconds]
        [Time since previous frame in this TCP stream: 0.019975000 seconds]
    TCP payload (526 bytes)
    [PDU Size: 526]
OpcUa Binary Protocol
    Message Type: MSG
    Chunk Type: F
    Message Size: 526
    SecureChannelId: 2
    Security Token Id: 2
    Security Sequence Number: 2
    Security RequestId: 2
    OpcUa Service : Encodeable Object
        TypeId : ExpandedNodeId
            NodeId EncodingMask: Four byte encoded Numeric (0x01)
            NodeId Namespace Index: 0
            NodeId Identifier Numeric: CreateSessionResponse (464)
        CreateSessionResponse
            ResponseHeader: ResponseHeader
                Timestamp: Oct 16, 2018 11:35:09.111000000 Mitteleuropäische Sommerzeit
                RequestHandle: 1000001
                ServiceResult: 0x00000000 [Good]
                ServiceDiagnostics: DiagnosticInfo
                    EncodingMask: 0x00
                        .... ...0 = has symbolic id: False
                        .... ..0. = has namespace: False
                        .... .0.. = has localizedtext: False
                        .... 0... = has locale: False
                        ...0 .... = has additional info: False
                        ..0. .... = has inner statuscode: False
                        .0.. .... = has inner diagnostic info: False
                StringTable: Array of String
                    ArraySize: -1
                AdditionalHeader: ExtensionObject
                    TypeId: ExpandedNodeId
                        EncodingMask: 0x00, EncodingMask: Two byte encoded Numeric
                            .... 0000 = EncodingMask: Two byte encoded Numeric (0x0)
                            .0.. .... = has server index: False
                            0... .... = has namespace uri: False
                        Identifier Numeric: 0
                    EncodingMask: 0x00
                        .... ...0 = has binary body: False
                        .... ..0. = has xml body: False
            SessionId: NodeId
                .... 0100 = EncodingMask: GUID (0x4)
                Namespace Index: 1
                Identifier Guid: 5d8b9a70-711d-21ce-5905-c07c5475d75d
            AuthenticationToken: NodeId
                .... 0100 = EncodingMask: GUID (0x4)
                Namespace Index: 1
                Identifier Guid: f54ae449-1cc1-9668-5965-06202b62b61b
            RevisedSessionTimeout: 1200000
            ServerNonce: 093a7e147f5c5bffa25af1c46a786589475cfa5fd6ff2f95...
            ServerCertificate: <MISSING>[OpcUa Null ByteString]
            ServerEndpoints: Array of EndpointDescription
                ArraySize: 1
                [0]: EndpointDescription
                    EndpointUrl: opc.tcp://192.168.0.20:4840/
                    Server: ApplicationDescription
                        ApplicationUri: urn:0.0.0.0:OPC UA Server - Micro for NPX
                        ProductUri: www.hilscher.com/UaServer
                        ApplicationName: LocalizedText
                            EncodingMask: 0x03, has locale information, has text
                                .... ...1 = has locale information: True
                                .... ..1. = has text: True
                            Locale: en
                            Text: OPC UA Server - Micro for NPX
                        ApplicationType: Server (0x00000000)
                        GatewayServerUri: [OpcUa Null String]
                        DiscoveryProfileUri: [OpcUa Null String]
                        DiscoveryUrls: Array of String
                            ArraySize: -1
                    ServerCertificate: <MISSING>[OpcUa Null ByteString]
                    MessageSecurityMode: None (0x00000001)
                    SecurityPolicyUri: http://opcfoundation.org/UA/SecurityPolicy#None
                    UserIdentityTokens: Array of UserTokenPolicy
                        ArraySize: 2
                        [0]: UserTokenPolicy
                            PolicyId: AnonymousIdentity
                            UserTokenType: Anonymous (0x00000000)
                            IssuedTokenType: [OpcUa Null String]
                            IssuerEndpointUrl: [OpcUa Null String]
                            SecurityPolicyUri: [OpcUa Null String]
                        [1]: UserTokenPolicy
                            PolicyId: UserNameIdentity
                            UserTokenType: UserName (0x00000001)
                            IssuedTokenType: [OpcUa Null String]
                            IssuerEndpointUrl: [OpcUa Null String]
                            SecurityPolicyUri: [OpcUa Null String]
                    TransportProfileUri: http://opcfoundation.org/UA-Profile/Transport/uatcp-uasc-uabinary
                    SecurityLevel: 0
            ServerSoftwareCertificates: Array of SignedSoftwareCertificate
                ArraySize: -1
            ServerSignature: SignatureData
                Algorithm: [OpcUa Null String]
                Signature: <MISSING>[OpcUa Null ByteString]
            MaxRequestMessageSize: 0

```

3) ActivateSessionResponse
```
Frame 152: 150 bytes on wire (1200 bits), 150 bytes captured (1200 bits) on interface 0
    Interface id: 0 (\Device\NPF_{5295E406-3F56-45E1-9A83-302580141ACC})
        Interface name: \Device\NPF_{5295E406-3F56-45E1-9A83-302580141ACC}
    Encapsulation type: Ethernet (1)
    Arrival Time: Oct 16, 2018 11:35:08.655360000 Mitteleuropäische Sommerzeit
    [Time shift for this packet: 0.000000000 seconds]
    Epoch Time: 1539682508.655360000 seconds
    [Time delta from previous captured frame: 0.019618000 seconds]
    [Time delta from previous displayed frame: 0.019618000 seconds]
    [Time since reference or first frame: 40.182667000 seconds]
    Frame Number: 152
    Frame Length: 150 bytes (1200 bits)
    Capture Length: 150 bytes (1200 bits)
    [Frame is marked: False]
    [Frame is ignored: False]
    [Protocols in frame: eth:ethertype:ip:tcp:opcua]
    [Coloring Rule Name: TCP]
    [Coloring Rule String: tcp]
Ethernet II, Src: Hilscher_2c:b7:3d (00:02:a2:2c:b7:3d), Dst: Luxshare_0e:ee:05 (3c:18:a0:0e:ee:05)
    Destination: Luxshare_0e:ee:05 (3c:18:a0:0e:ee:05)
        Address: Luxshare_0e:ee:05 (3c:18:a0:0e:ee:05)
        .... ..0. .... .... .... .... = LG bit: Globally unique address (factory default)
        .... ...0 .... .... .... .... = IG bit: Individual address (unicast)
    Source: Hilscher_2c:b7:3d (00:02:a2:2c:b7:3d)
        Address: Hilscher_2c:b7:3d (00:02:a2:2c:b7:3d)
        .... ..0. .... .... .... .... = LG bit: Globally unique address (factory default)
        .... ...0 .... .... .... .... = IG bit: Individual address (unicast)
    Type: IPv4 (0x0800)
Internet Protocol Version 4, Src: 192.168.0.20, Dst: 192.168.0.10
    0100 .... = Version: 4
    .... 0101 = Header Length: 20 bytes (5)
    Differentiated Services Field: 0x00 (DSCP: CS0, ECN: Not-ECT)
        0000 00.. = Differentiated Services Codepoint: Default (0)
        .... ..00 = Explicit Congestion Notification: Not ECN-Capable Transport (0)
    Total Length: 136
    Identification: 0x000c (12)
    Flags: 0x0000
        0... .... .... .... = Reserved bit: Not set
        .0.. .... .... .... = Don't fragment: Not set
        ..0. .... .... .... = More fragments: Not set
        ...0 0000 0000 0000 = Fragment offset: 0
    Time to live: 64
    Protocol: TCP (6)
    Header checksum: 0xf8f5 [validation disabled]
    [Header checksum status: Unverified]
    Source: 192.168.0.20
    Destination: 192.168.0.10
Transmission Control Protocol, Src Port: 4840, Dst Port: 52077, Seq: 690, Ack: 660, Len: 96
    Source Port: 4840
    Destination Port: 52077
    [Stream index: 1]
    [TCP Segment Len: 96]
    Sequence number: 690    (relative sequence number)
    [Next sequence number: 786    (relative sequence number)]
    Acknowledgment number: 660    (relative ack number)
    0101 .... = Header Length: 20 bytes (5)
    Flags: 0x018 (PSH, ACK)
        000. .... .... = Reserved: Not set
        ...0 .... .... = Nonce: Not set
        .... 0... .... = Congestion Window Reduced (CWR): Not set
        .... .0.. .... = ECN-Echo: Not set
        .... ..0. .... = Urgent: Not set
        .... ...1 .... = Acknowledgment: Set
        .... .... 1... = Push: Set
        .... .... .0.. = Reset: Not set
        .... .... ..0. = Syn: Not set
        .... .... ...0 = Fin: Not set
        [TCP Flags: ·······AP···]
    Window size value: 2048
    [Calculated window size: 2048]
    [Window size scaling factor: -2 (no window scaling used)]
    Checksum: 0x567b [unverified]
    [Checksum Status: Unverified]
    Urgent pointer: 0
    [SEQ/ACK analysis]
        [This is an ACK to the segment in frame: 151]
        [The RTT to ACK the segment was: 0.019618000 seconds]
        [iRTT: 0.001521000 seconds]
        [Bytes in flight: 96]
        [Bytes sent since last PSH flag: 96]
    [Timestamps]
        [Time since first frame in this TCP stream: 0.075797000 seconds]
        [Time since previous frame in this TCP stream: 0.019618000 seconds]
    TCP payload (96 bytes)
    [PDU Size: 96]
OpcUa Binary Protocol
    Message Type: MSG
    Chunk Type: F
    Message Size: 96
    SecureChannelId: 2
    Security Token Id: 2
    Security Sequence Number: 3
    Security RequestId: 3
    OpcUa Service : Encodeable Object
        TypeId : ExpandedNodeId
            NodeId EncodingMask: Four byte encoded Numeric (0x01)
            NodeId Namespace Index: 0
            NodeId Identifier Numeric: ActivateSessionResponse (470)
        ActivateSessionResponse
            ResponseHeader: ResponseHeader
                Timestamp: Oct 16, 2018 11:35:09.131000000 Mitteleuropäische Sommerzeit
                RequestHandle: 1000002
                ServiceResult: 0x00000000 [Good]
                ServiceDiagnostics: DiagnosticInfo
                    EncodingMask: 0x00
                        .... ...0 = has symbolic id: False
                        .... ..0. = has namespace: False
                        .... .0.. = has localizedtext: False
                        .... 0... = has locale: False
                        ...0 .... = has additional info: False
                        ..0. .... = has inner statuscode: False
                        .0.. .... = has inner diagnostic info: False
                StringTable: Array of String
                    ArraySize: -1
                AdditionalHeader: ExtensionObject
                    TypeId: ExpandedNodeId
                        EncodingMask: 0x00, EncodingMask: Two byte encoded Numeric
                            .... 0000 = EncodingMask: Two byte encoded Numeric (0x0)
                            .0.. .... = has server index: False
                            0... .... = has namespace uri: False
                        Identifier Numeric: 0
                    EncodingMask: 0x00
                        .... ...0 = has binary body: False
                        .... ..0. = has xml body: False
            ServerNonce: f2ef5a28aff84ef61093aa31d6a7beffda6f9680706e62ed...
            Results: Array of StatusCode
                ArraySize: -1
            DiagnosticInfos: Array of DiagnosticInfo
                ArraySize: -1

```

4) CreateSubscriptionResponse

```
Frame 572: 126 bytes on wire (1008 bits), 126 bytes captured (1008 bits) on interface 0
    Interface id: 0 (\Device\NPF_{5295E406-3F56-45E1-9A83-302580141ACC})
        Interface name: \Device\NPF_{5295E406-3F56-45E1-9A83-302580141ACC}
    Encapsulation type: Ethernet (1)
    Arrival Time: Oct 16, 2018 11:39:42.612698000 Mitteleuropäische Sommerzeit
    [Time shift for this packet: 0.000000000 seconds]
    Epoch Time: 1539682782.612698000 seconds
    [Time delta from previous captured frame: 0.017319000 seconds]
    [Time delta from previous displayed frame: 0.017319000 seconds]
    [Time since reference or first frame: 314.140005000 seconds]
    Frame Number: 572
    Frame Length: 126 bytes (1008 bits)
    Capture Length: 126 bytes (1008 bits)
    [Frame is marked: False]
    [Frame is ignored: False]
    [Protocols in frame: eth:ethertype:ip:tcp:opcua]
    [Coloring Rule Name: TCP]
    [Coloring Rule String: tcp]
Ethernet II, Src: Hilscher_2c:b7:3d (00:02:a2:2c:b7:3d), Dst: Luxshare_0e:ee:05 (3c:18:a0:0e:ee:05)
    Destination: Luxshare_0e:ee:05 (3c:18:a0:0e:ee:05)
        Address: Luxshare_0e:ee:05 (3c:18:a0:0e:ee:05)
        .... ..0. .... .... .... .... = LG bit: Globally unique address (factory default)
        .... ...0 .... .... .... .... = IG bit: Individual address (unicast)
    Source: Hilscher_2c:b7:3d (00:02:a2:2c:b7:3d)
        Address: Hilscher_2c:b7:3d (00:02:a2:2c:b7:3d)
        .... ..0. .... .... .... .... = LG bit: Globally unique address (factory default)
        .... ...0 .... .... .... .... = IG bit: Individual address (unicast)
    Type: IPv4 (0x0800)
Internet Protocol Version 4, Src: 192.168.0.20, Dst: 192.168.0.10
    0100 .... = Version: 4
    .... 0101 = Header Length: 20 bytes (5)
    Differentiated Services Field: 0x00 (DSCP: CS0, ECN: Not-ECT)
        0000 00.. = Differentiated Services Codepoint: Default (0)
        .... ..00 = Explicit Congestion Notification: Not ECN-Capable Transport (0)
    Total Length: 112
    Identification: 0x00d1 (209)
    Flags: 0x0000
        0... .... .... .... = Reserved bit: Not set
        .0.. .... .... .... = Don't fragment: Not set
        ..0. .... .... .... = More fragments: Not set
        ...0 0000 0000 0000 = Fragment offset: 0
    Time to live: 64
    Protocol: TCP (6)
    Header checksum: 0xf848 [validation disabled]
    [Header checksum status: Unverified]
    Source: 192.168.0.20
    Destination: 192.168.0.10
Transmission Control Protocol, Src Port: 4840, Dst Port: 52077, Seq: 17656, Ack: 14981, Len: 72
    Source Port: 4840
    Destination Port: 52077
    [Stream index: 1]
    [TCP Segment Len: 72]
    Sequence number: 17656    (relative sequence number)
    [Next sequence number: 17728    (relative sequence number)]
    Acknowledgment number: 14981    (relative ack number)
    0101 .... = Header Length: 20 bytes (5)
    Flags: 0x018 (PSH, ACK)
        000. .... .... = Reserved: Not set
        ...0 .... .... = Nonce: Not set
        .... 0... .... = Congestion Window Reduced (CWR): Not set
        .... .0.. .... = ECN-Echo: Not set
        .... ..0. .... = Urgent: Not set
        .... ...1 .... = Acknowledgment: Set
        .... .... 1... = Push: Set
        .... .... .0.. = Reset: Not set
        .... .... ..0. = Syn: Not set
        .... .... ...0 = Fin: Not set
        [TCP Flags: ·······AP···]
    Window size value: 2048
    [Calculated window size: 2048]
    [Window size scaling factor: -2 (no window scaling used)]
    Checksum: 0x12d5 [unverified]
    [Checksum Status: Unverified]
    Urgent pointer: 0
    [SEQ/ACK analysis]
        [This is an ACK to the segment in frame: 571]
        [The RTT to ACK the segment was: 0.017319000 seconds]
        [iRTT: 0.001521000 seconds]
        [Bytes in flight: 72]
        [Bytes sent since last PSH flag: 72]
    [Timestamps]
        [Time since first frame in this TCP stream: 274.033135000 seconds]
        [Time since previous frame in this TCP stream: 0.017319000 seconds]
    TCP payload (72 bytes)
    [PDU Size: 72]
OpcUa Binary Protocol
    Message Type: MSG
    Chunk Type: F
    Message Size: 72
    SecureChannelId: 2
    Security Token Id: 2
    Security Sequence Number: 137
    Security RequestId: 139
    OpcUa Service : Encodeable Object
        TypeId : ExpandedNodeId
            NodeId EncodingMask: Four byte encoded Numeric (0x01)
            NodeId Namespace Index: 0
            NodeId Identifier Numeric: CreateSubscriptionResponse (790)
        CreateSubscriptionResponse
            ResponseHeader: ResponseHeader
                Timestamp: Oct 16, 2018 11:39:43.101000000 Mitteleuropäische Sommerzeit
                RequestHandle: 1000138
                ServiceResult: 0x00000000 [Good]
                ServiceDiagnostics: DiagnosticInfo
                    EncodingMask: 0x00
                        .... ...0 = has symbolic id: False
                        .... ..0. = has namespace: False
                        .... .0.. = has localizedtext: False
                        .... 0... = has locale: False
                        ...0 .... = has additional info: False
                        ..0. .... = has inner statuscode: False
                        .0.. .... = has inner diagnostic info: False
                StringTable: Array of String
                    ArraySize: -1
                AdditionalHeader: ExtensionObject
                    TypeId: ExpandedNodeId
                        EncodingMask: 0x00, EncodingMask: Two byte encoded Numeric
                            .... 0000 = EncodingMask: Two byte encoded Numeric (0x0)
                            .0.. .... = has server index: False
                            0... .... = has namespace uri: False
                        Identifier Numeric: 0
                    EncodingMask: 0x00
                        .... ...0 = has binary body: False
                        .... ..0. = has xml body: False
            SubscriptionId: 2
            RevisedPublishingInterval: 1000
            RevisedLifetimeCount: 1200
            RevisedMaxKeepAliveCount: 6

```

5) CreateMonitoredItemsResponse

```
Frame 1191: 137 bytes on wire (1096 bits), 137 bytes captured (1096 bits) on interface 0
    Interface id: 0 (\Device\NPF_{5295E406-3F56-45E1-9A83-302580141ACC})
        Interface name: \Device\NPF_{5295E406-3F56-45E1-9A83-302580141ACC}
    Encapsulation type: Ethernet (1)
    Arrival Time: Oct 16, 2018 11:39:48.682337000 Mitteleuropäische Sommerzeit
    [Time shift for this packet: 0.000000000 seconds]
    Epoch Time: 1539682788.682337000 seconds
    [Time delta from previous captured frame: 0.025136000 seconds]
    [Time delta from previous displayed frame: 0.026931000 seconds]
    [Time since reference or first frame: 320.209644000 seconds]
    Frame Number: 1191
    Frame Length: 137 bytes (1096 bits)
    Capture Length: 137 bytes (1096 bits)
    [Frame is marked: False]
    [Frame is ignored: False]
    [Protocols in frame: eth:ethertype:ip:tcp:opcua]
    [Coloring Rule Name: TCP]
    [Coloring Rule String: tcp]
Ethernet II, Src: Hilscher_2c:b7:3d (00:02:a2:2c:b7:3d), Dst: Luxshare_0e:ee:05 (3c:18:a0:0e:ee:05)
    Destination: Luxshare_0e:ee:05 (3c:18:a0:0e:ee:05)
        Address: Luxshare_0e:ee:05 (3c:18:a0:0e:ee:05)
        .... ..0. .... .... .... .... = LG bit: Globally unique address (factory default)
        .... ...0 .... .... .... .... = IG bit: Individual address (unicast)
    Source: Hilscher_2c:b7:3d (00:02:a2:2c:b7:3d)
        Address: Hilscher_2c:b7:3d (00:02:a2:2c:b7:3d)
        .... ..0. .... .... .... .... = LG bit: Globally unique address (factory default)
        .... ...0 .... .... .... .... = IG bit: Individual address (unicast)
    Type: IPv4 (0x0800)
Internet Protocol Version 4, Src: 192.168.0.20, Dst: 192.168.0.10
    0100 .... = Version: 4
    .... 0101 = Header Length: 20 bytes (5)
    Differentiated Services Field: 0x00 (DSCP: CS0, ECN: Not-ECT)
        0000 00.. = Differentiated Services Codepoint: Default (0)
        .... ..00 = Explicit Congestion Notification: Not ECN-Capable Transport (0)
    Total Length: 123
    Identification: 0x0207 (519)
    Flags: 0x0000
        0... .... .... .... = Reserved bit: Not set
        .0.. .... .... .... = Don't fragment: Not set
        ..0. .... .... .... = More fragments: Not set
        ...0 0000 0000 0000 = Fragment offset: 0
    Time to live: 64
    Protocol: TCP (6)
    Header checksum: 0xf707 [validation disabled]
    [Header checksum status: Unverified]
    Source: 192.168.0.20
    Destination: 192.168.0.10
Transmission Control Protocol, Src Port: 4840, Dst Port: 52077, Seq: 57624, Ack: 50728, Len: 83
    Source Port: 4840
    Destination Port: 52077
    [Stream index: 1]
    [TCP Segment Len: 83]
    Sequence number: 57624    (relative sequence number)
    [Next sequence number: 57707    (relative sequence number)]
    Acknowledgment number: 50728    (relative ack number)
    0101 .... = Header Length: 20 bytes (5)
    Flags: 0x018 (PSH, ACK)
        000. .... .... = Reserved: Not set
        ...0 .... .... = Nonce: Not set
        .... 0... .... = Congestion Window Reduced (CWR): Not set
        .... .0.. .... = ECN-Echo: Not set
        .... ..0. .... = Urgent: Not set
        .... ...1 .... = Acknowledgment: Set
        .... .... 1... = Push: Set
        .... .... .0.. = Reset: Not set
        .... .... ..0. = Syn: Not set
        .... .... ...0 = Fin: Not set
        [TCP Flags: ·······AP···]
    Window size value: 2048
    [Calculated window size: 2048]
    [Window size scaling factor: -2 (no window scaling used)]
    Checksum: 0x6297 [unverified]
    [Checksum Status: Unverified]
    Urgent pointer: 0
    [SEQ/ACK analysis]
        [iRTT: 0.001521000 seconds]
        [Bytes in flight: 83]
        [Bytes sent since last PSH flag: 83]
    [Timestamps]
        [Time since first frame in this TCP stream: 280.102774000 seconds]
        [Time since previous frame in this TCP stream: 0.025136000 seconds]
    TCP payload (83 bytes)
    [PDU Size: 83]
OpcUa Binary Protocol
    Message Type: MSG
    Chunk Type: F
    Message Size: 83
    SecureChannelId: 2
    Security Token Id: 2
    Security Sequence Number: 442
    Security RequestId: 445
    OpcUa Service : Encodeable Object
        TypeId : ExpandedNodeId
            NodeId EncodingMask: Four byte encoded Numeric (0x01)
            NodeId Namespace Index: 0
            NodeId Identifier Numeric: CreateMonitoredItemsResponse (754)
        CreateMonitoredItemsResponse
            ResponseHeader: ResponseHeader
                Timestamp: Oct 16, 2018 11:39:49.164000000 Mitteleuropäische Sommerzeit
                RequestHandle: 1000444
                ServiceResult: 0x00000000 [Good]
                ServiceDiagnostics: DiagnosticInfo
                    EncodingMask: 0x00
                        .... ...0 = has symbolic id: False
                        .... ..0. = has namespace: False
                        .... .0.. = has localizedtext: False
                        .... 0... = has locale: False
                        ...0 .... = has additional info: False
                        ..0. .... = has inner statuscode: False
                        .0.. .... = has inner diagnostic info: False
                StringTable: Array of String
                    ArraySize: -1
                AdditionalHeader: ExtensionObject
                    TypeId: ExpandedNodeId
                        EncodingMask: 0x00, EncodingMask: Two byte encoded Numeric
                            .... 0000 = EncodingMask: Two byte encoded Numeric (0x0)
                            .0.. .... = has server index: False
                            0... .... = has namespace uri: False
                        Identifier Numeric: 0
                    EncodingMask: 0x00
                        .... ...0 = has binary body: False
                        .... ..0. = has xml body: False
            Results: Array of MonitoredItemCreateResult
                ArraySize: 1
                [0]: MonitoredItemCreateResult
                    StatusCode: 0x00000000 [Good]
                    MonitoredItemId: 1
                    RevisedSamplingInterval: 10000
                    RevisedQueueSize: 1
                    FilterResult: ExtensionObject
                        TypeId: ExpandedNodeId
                            EncodingMask: 0x00, EncodingMask: Two byte encoded Numeric
                                .... 0000 = EncodingMask: Two byte encoded Numeric (0x0)
                                .0.. .... = has server index: False
                                0... .... = has namespace uri: False
                            Identifier Numeric: 0
                        EncodingMask: 0x00
                            .... ...0 = has binary body: False
                            .... ..0. = has xml body: False
            DiagnosticInfos: Array of DiagnosticInfo
                ArraySize: -1

```

6) CallResponse

```
Frame 1628: 130 bytes on wire (1040 bits), 130 bytes captured (1040 bits) on interface 0
    Interface id: 0 (\Device\NPF_{5295E406-3F56-45E1-9A83-302580141ACC})
        Interface name: \Device\NPF_{5295E406-3F56-45E1-9A83-302580141ACC}
    Encapsulation type: Ethernet (1)
    Arrival Time: Oct 16, 2018 11:43:37.981598000 Mitteleuropäische Sommerzeit
    [Time shift for this packet: 0.000000000 seconds]
    Epoch Time: 1539683017.981598000 seconds
    [Time delta from previous captured frame: 0.670112000 seconds]
    [Time delta from previous displayed frame: 0.862273000 seconds]
    [Time since reference or first frame: 549.508905000 seconds]
    Frame Number: 1628
    Frame Length: 130 bytes (1040 bits)
    Capture Length: 130 bytes (1040 bits)
    [Frame is marked: False]
    [Frame is ignored: False]
    [Protocols in frame: eth:ethertype:ip:tcp:opcua]
    [Coloring Rule Name: TCP]
    [Coloring Rule String: tcp]
Ethernet II, Src: Hilscher_2c:b7:3d (00:02:a2:2c:b7:3d), Dst: Luxshare_0e:ee:05 (3c:18:a0:0e:ee:05)
    Destination: Luxshare_0e:ee:05 (3c:18:a0:0e:ee:05)
        Address: Luxshare_0e:ee:05 (3c:18:a0:0e:ee:05)
        .... ..0. .... .... .... .... = LG bit: Globally unique address (factory default)
        .... ...0 .... .... .... .... = IG bit: Individual address (unicast)
    Source: Hilscher_2c:b7:3d (00:02:a2:2c:b7:3d)
        Address: Hilscher_2c:b7:3d (00:02:a2:2c:b7:3d)
        .... ..0. .... .... .... .... = LG bit: Globally unique address (factory default)
        .... ...0 .... .... .... .... = IG bit: Individual address (unicast)
    Type: IPv4 (0x0800)
Internet Protocol Version 4, Src: 192.168.0.20, Dst: 192.168.0.10
    0100 .... = Version: 4
    .... 0101 = Header Length: 20 bytes (5)
    Differentiated Services Field: 0x00 (DSCP: CS0, ECN: Not-ECT)
        0000 00.. = Differentiated Services Codepoint: Default (0)
        .... ..00 = Explicit Congestion Notification: Not ECN-Capable Transport (0)
    Total Length: 116
    Identification: 0x02ea (746)
    Flags: 0x0000
        0... .... .... .... = Reserved bit: Not set
        .0.. .... .... .... = Don't fragment: Not set
        ..0. .... .... .... = More fragments: Not set
        ...0 0000 0000 0000 = Fragment offset: 0
    Time to live: 64
    Protocol: TCP (6)
    Header checksum: 0xf62b [validation disabled]
    [Header checksum status: Unverified]
    Source: 192.168.0.20
    Destination: 192.168.0.10
Transmission Control Protocol, Src Port: 4840, Dst Port: 52077, Seq: 69000, Ack: 63216, Len: 76
    Source Port: 4840
    Destination Port: 52077
    [Stream index: 1]
    [TCP Segment Len: 76]
    Sequence number: 69000    (relative sequence number)
    [Next sequence number: 69076    (relative sequence number)]
    Acknowledgment number: 63216    (relative ack number)
    0101 .... = Header Length: 20 bytes (5)
    Flags: 0x018 (PSH, ACK)
        000. .... .... = Reserved: Not set
        ...0 .... .... = Nonce: Not set
        .... 0... .... = Congestion Window Reduced (CWR): Not set
        .... .0.. .... = ECN-Echo: Not set
        .... ..0. .... = Urgent: Not set
        .... ...1 .... = Acknowledgment: Set
        .... .... 1... = Push: Set
        .... .... .0.. = Reset: Not set
        .... .... ..0. = Syn: Not set
        .... .... ...0 = Fin: Not set
        [TCP Flags: ·······AP···]
    Window size value: 2048
    [Calculated window size: 2048]
    [Window size scaling factor: -2 (no window scaling used)]
    Checksum: 0xaf95 [unverified]
    [Checksum Status: Unverified]
    Urgent pointer: 0
    [SEQ/ACK analysis]
        [iRTT: 0.001521000 seconds]
        [Bytes in flight: 76]
        [Bytes sent since last PSH flag: 76]
    [Timestamps]
        [Time since first frame in this TCP stream: 509.402035000 seconds]
        [Time since previous frame in this TCP stream: 0.670112000 seconds]
    TCP payload (76 bytes)
    [PDU Size: 76]
OpcUa Binary Protocol
    Message Type: MSG
    Chunk Type: F
    Message Size: 76
    SecureChannelId: 2
    Security Token Id: 3
    Security Sequence Number: 579
    Security RequestId: 582
    OpcUa Service : Encodeable Object
        TypeId : ExpandedNodeId
            NodeId EncodingMask: Four byte encoded Numeric (0x01)
            NodeId Namespace Index: 0
            NodeId Identifier Numeric: CallResponse (715)
        CallResponse
            ResponseHeader: ResponseHeader
                Timestamp: Oct 16, 2018 11:43:37.636000000 Mitteleuropäische Sommerzeit
                RequestHandle: 1000580
                ServiceResult: 0x00000000 [Good]
                ServiceDiagnostics: DiagnosticInfo
                    EncodingMask: 0x00
                        .... ...0 = has symbolic id: False
                        .... ..0. = has namespace: False
                        .... .0.. = has localizedtext: False
                        .... 0... = has locale: False
                        ...0 .... = has additional info: False
                        ..0. .... = has inner statuscode: False
                        .0.. .... = has inner diagnostic info: False
                StringTable: Array of String
                    ArraySize: -1
                AdditionalHeader: ExtensionObject
                    TypeId: ExpandedNodeId
                        EncodingMask: 0x00, EncodingMask: Two byte encoded Numeric
                            .... 0000 = EncodingMask: Two byte encoded Numeric (0x0)
                            .0.. .... = has server index: False
                            0... .... = has namespace uri: False
                        Identifier Numeric: 0
                    EncodingMask: 0x00
                        .... ...0 = has binary body: False
                        .... ..0. = has xml body: False
            Results: Array of CallMethodResult
                ArraySize: 1
                [0]: CallMethodResult
                    StatusCode: 0x00000000 [Good]
                    InputArgumentResults: Array of StatusCode
                        ArraySize: -1
                    InputArgumentDiagnosticInfos: Array of DiagnosticInfo
                        ArraySize: -1
                    OutputArguments: Array of Variant
                        ArraySize: 0
            DiagnosticInfos: Array of DiagnosticInfo
                ArraySize: -1

```

7) first PublishResponse

```
Frame 1629: 217 bytes on wire (1736 bits), 217 bytes captured (1736 bits) on interface 0
    Interface id: 0 (\Device\NPF_{5295E406-3F56-45E1-9A83-302580141ACC})
        Interface name: \Device\NPF_{5295E406-3F56-45E1-9A83-302580141ACC}
    Encapsulation type: Ethernet (1)
    Arrival Time: Oct 16, 2018 11:43:37.981734000 Mitteleuropäische Sommerzeit
    [Time shift for this packet: 0.000000000 seconds]
    Epoch Time: 1539683017.981734000 seconds
    [Time delta from previous captured frame: 0.000136000 seconds]
    [Time delta from previous displayed frame: 0.000136000 seconds]
    [Time since reference or first frame: 549.509041000 seconds]
    Frame Number: 1629
    Frame Length: 217 bytes (1736 bits)
    Capture Length: 217 bytes (1736 bits)
    [Frame is marked: False]
    [Frame is ignored: False]
    [Protocols in frame: eth:ethertype:ip:tcp:opcua]
    [Coloring Rule Name: TCP]
    [Coloring Rule String: tcp]
Ethernet II, Src: Hilscher_2c:b7:3d (00:02:a2:2c:b7:3d), Dst: Luxshare_0e:ee:05 (3c:18:a0:0e:ee:05)
    Destination: Luxshare_0e:ee:05 (3c:18:a0:0e:ee:05)
        Address: Luxshare_0e:ee:05 (3c:18:a0:0e:ee:05)
        .... ..0. .... .... .... .... = LG bit: Globally unique address (factory default)
        .... ...0 .... .... .... .... = IG bit: Individual address (unicast)
    Source: Hilscher_2c:b7:3d (00:02:a2:2c:b7:3d)
        Address: Hilscher_2c:b7:3d (00:02:a2:2c:b7:3d)
        .... ..0. .... .... .... .... = LG bit: Globally unique address (factory default)
        .... ...0 .... .... .... .... = IG bit: Individual address (unicast)
    Type: IPv4 (0x0800)
Internet Protocol Version 4, Src: 192.168.0.20, Dst: 192.168.0.10
    0100 .... = Version: 4
    .... 0101 = Header Length: 20 bytes (5)
    Differentiated Services Field: 0x00 (DSCP: CS0, ECN: Not-ECT)
        0000 00.. = Differentiated Services Codepoint: Default (0)
        .... ..00 = Explicit Congestion Notification: Not ECN-Capable Transport (0)
    Total Length: 203
    Identification: 0x02eb (747)
    Flags: 0x0000
        0... .... .... .... = Reserved bit: Not set
        .0.. .... .... .... = Don't fragment: Not set
        ..0. .... .... .... = More fragments: Not set
        ...0 0000 0000 0000 = Fragment offset: 0
    Time to live: 64
    Protocol: TCP (6)
    Header checksum: 0xf5d3 [validation disabled]
    [Header checksum status: Unverified]
    Source: 192.168.0.20
    Destination: 192.168.0.10
Transmission Control Protocol, Src Port: 4840, Dst Port: 52077, Seq: 69076, Ack: 63216, Len: 163
    Source Port: 4840
    Destination Port: 52077
    [Stream index: 1]
    [TCP Segment Len: 163]
    Sequence number: 69076    (relative sequence number)
    [Next sequence number: 69239    (relative sequence number)]
    Acknowledgment number: 63216    (relative ack number)
    0101 .... = Header Length: 20 bytes (5)
    Flags: 0x018 (PSH, ACK)
        000. .... .... = Reserved: Not set
        ...0 .... .... = Nonce: Not set
        .... 0... .... = Congestion Window Reduced (CWR): Not set
        .... .0.. .... = ECN-Echo: Not set
        .... ..0. .... = Urgent: Not set
        .... ...1 .... = Acknowledgment: Set
        .... .... 1... = Push: Set
        .... .... .0.. = Reset: Not set
        .... .... ..0. = Syn: Not set
        .... .... ...0 = Fin: Not set
        [TCP Flags: ·······AP···]
    Window size value: 2048
    [Calculated window size: 2048]
    [Window size scaling factor: -2 (no window scaling used)]
    Checksum: 0xc970 [unverified]
    [Checksum Status: Unverified]
    Urgent pointer: 0
    [SEQ/ACK analysis]
        [iRTT: 0.001521000 seconds]
        [Bytes in flight: 239]
        [Bytes sent since last PSH flag: 163]
    [Timestamps]
        [Time since first frame in this TCP stream: 509.402171000 seconds]
        [Time since previous frame in this TCP stream: 0.000136000 seconds]
    TCP payload (163 bytes)
    [PDU Size: 163]
OpcUa Binary Protocol
    Message Type: MSG
    Chunk Type: F
    Message Size: 163
    SecureChannelId: 2
    Security Token Id: 3
    Security Sequence Number: 580
    Security RequestId: 573
    OpcUa Service : Encodeable Object
        TypeId : ExpandedNodeId
            NodeId EncodingMask: Four byte encoded Numeric (0x01)
            NodeId Namespace Index: 0
            NodeId Identifier Numeric: PublishResponse (829)
        PublishResponse
            ResponseHeader: ResponseHeader
                Timestamp: Oct 16, 2018 11:43:38.481000000 Mitteleuropäische Sommerzeit
                RequestHandle: 1000571
                ServiceResult: 0x00000000 [Good]
                ServiceDiagnostics: DiagnosticInfo
                    EncodingMask: 0x00
                        .... ...0 = has symbolic id: False
                        .... ..0. = has namespace: False
                        .... .0.. = has localizedtext: False
                        .... 0... = has locale: False
                        ...0 .... = has additional info: False
                        ..0. .... = has inner statuscode: False
                        .0.. .... = has inner diagnostic info: False
                StringTable: Array of String
                    ArraySize: -1
                AdditionalHeader: ExtensionObject
                    TypeId: ExpandedNodeId
                        EncodingMask: 0x00, EncodingMask: Two byte encoded Numeric
                            .... 0000 = EncodingMask: Two byte encoded Numeric (0x0)
                            .0.. .... = has server index: False
                            0... .... = has namespace uri: False
                        Identifier Numeric: 0
                    EncodingMask: 0x00
                        .... ...0 = has binary body: False
                        .... ..0. = has xml body: False
            SubscriptionId: 1
            AvailableSequenceNumbers: Array of UInt32
                ArraySize: 1
                [0]: AvailableSequenceNumbers: 1
            MoreNotifications: False
            NotificationMessage: NotificationMessage
                SequenceNumber: 1
                PublishTime: Oct 16, 2018 11:43:38.481000000 Mitteleuropäische Sommerzeit
                NotificationData: Array of ExtensionObject
                    ArraySize: 1
                    [0]: ExtensionObject
                        TypeId: ExpandedNodeId
                            EncodingMask: 0x01, EncodingMask: Four byte encoded Numeric
                                .... 0001 = EncodingMask: Four byte encoded Numeric (0x1)
                                .0.. .... = has server index: False
                                0... .... = has namespace uri: False
                            Namespace Index: 0
                            Identifier Numeric: 916
                        EncodingMask: 0x01, has binary body
                            .... ...1 = has binary body: True
                            .... ..0. = has xml body: False
                        EventNotificationList: EventNotificationList
                            Events: Array of EventFieldList
                                ArraySize: 5
                                [0]: EventFieldList
                                    ClientHandle: 0
                                    EventFields: Array of Variant
                                        ArraySize: 1
                                        [0]: Variant
                                            Variant Type: NodeId (0x11)
                                            Value: NodeId
                                                .... 0001 = EncodingMask: Four byte encoded Numeric (0x1)
                                                Namespace Index: 0
                                                Identifier Numeric: 4035
                                [1]: EventFieldList
                                    ClientHandle: 0
                                    EventFields: Array of Variant
                                        ArraySize: 1
                                        [0]: Variant
                                            Variant Type: NodeId (0x11)
                                            Value: NodeId
                                                .... 0001 = EncodingMask: Four byte encoded Numeric (0x1)
                                                Namespace Index: 0
                                                Identifier Numeric: 4035
                                [2]: EventFieldList
                                    ClientHandle: 0
                                    EventFields: Array of Variant
                                        ArraySize: 1
                                        [0]: Variant
                                            Variant Type: NodeId (0x11)
                                            Value: NodeId
                                                .... 0001 = EncodingMask: Four byte encoded Numeric (0x1)
                                                Namespace Index: 0
                                                Identifier Numeric: 4035
                                [3]: EventFieldList
                                    ClientHandle: 0
                                    EventFields: Array of Variant
                                        ArraySize: 1
                                        [0]: Variant
                                            Variant Type: NodeId (0x11)
                                            Value: NodeId
                                                .... 0001 = EncodingMask: Four byte encoded Numeric (0x1)
                                                Namespace Index: 0
                                                Identifier Numeric: 4035
                                [4]: EventFieldList
                                    ClientHandle: 0
                                    EventFields: Array of Variant
                                        ArraySize: 1
                                        [0]: Variant
                                            Variant Type: Null (0x00)
            Results: Array of StatusCode
                ArraySize: -1
            DiagnosticInfos: Array of DiagnosticInfo
                ArraySize: -1

```

8) Second PublishResponse

```
Frame 1632: 621 bytes on wire (4968 bits), 621 bytes captured (4968 bits) on interface 0
    Interface id: 0 (\Device\NPF_{5295E406-3F56-45E1-9A83-302580141ACC})
        Interface name: \Device\NPF_{5295E406-3F56-45E1-9A83-302580141ACC}
    Encapsulation type: Ethernet (1)
    Arrival Time: Oct 16, 2018 11:43:37.987305000 Mitteleuropäische Sommerzeit
    [Time shift for this packet: 0.000000000 seconds]
    Epoch Time: 1539683017.987305000 seconds
    [Time delta from previous captured frame: 0.001754000 seconds]
    [Time delta from previous displayed frame: 0.001754000 seconds]
    [Time since reference or first frame: 549.514612000 seconds]
    Frame Number: 1632
    Frame Length: 621 bytes (4968 bits)
    Capture Length: 621 bytes (4968 bits)
    [Frame is marked: False]
    [Frame is ignored: False]
    [Protocols in frame: eth:ethertype:ip:tcp:opcua]
    [Coloring Rule Name: TCP]
    [Coloring Rule String: tcp]
Ethernet II, Src: Hilscher_2c:b7:3d (00:02:a2:2c:b7:3d), Dst: Luxshare_0e:ee:05 (3c:18:a0:0e:ee:05)
    Destination: Luxshare_0e:ee:05 (3c:18:a0:0e:ee:05)
        Address: Luxshare_0e:ee:05 (3c:18:a0:0e:ee:05)
        .... ..0. .... .... .... .... = LG bit: Globally unique address (factory default)
        .... ...0 .... .... .... .... = IG bit: Individual address (unicast)
    Source: Hilscher_2c:b7:3d (00:02:a2:2c:b7:3d)
        Address: Hilscher_2c:b7:3d (00:02:a2:2c:b7:3d)
        .... ..0. .... .... .... .... = LG bit: Globally unique address (factory default)
        .... ...0 .... .... .... .... = IG bit: Individual address (unicast)
    Type: IPv4 (0x0800)
Internet Protocol Version 4, Src: 192.168.0.20, Dst: 192.168.0.10
    0100 .... = Version: 4
    .... 0101 = Header Length: 20 bytes (5)
    Differentiated Services Field: 0x00 (DSCP: CS0, ECN: Not-ECT)
        0000 00.. = Differentiated Services Codepoint: Default (0)
        .... ..00 = Explicit Congestion Notification: Not ECN-Capable Transport (0)
    Total Length: 607
    Identification: 0x02ec (748)
    Flags: 0x0000
        0... .... .... .... = Reserved bit: Not set
        .0.. .... .... .... = Don't fragment: Not set
        ..0. .... .... .... = More fragments: Not set
        ...0 0000 0000 0000 = Fragment offset: 0
    Time to live: 64
    Protocol: TCP (6)
    Header checksum: 0xf43e [validation disabled]
    [Header checksum status: Unverified]
    Source: 192.168.0.20
    Destination: 192.168.0.10
Transmission Control Protocol, Src Port: 4840, Dst Port: 52077, Seq: 69239, Ack: 63302, Len: 567
    Source Port: 4840
    Destination Port: 52077
    [Stream index: 1]
    [TCP Segment Len: 567]
    Sequence number: 69239    (relative sequence number)
    [Next sequence number: 69806    (relative sequence number)]
    Acknowledgment number: 63302    (relative ack number)
    0101 .... = Header Length: 20 bytes (5)
    Flags: 0x018 (PSH, ACK)
        000. .... .... = Reserved: Not set
        ...0 .... .... = Nonce: Not set
        .... 0... .... = Congestion Window Reduced (CWR): Not set
        .... .0.. .... = ECN-Echo: Not set
        .... ..0. .... = Urgent: Not set
        .... ...1 .... = Acknowledgment: Set
        .... .... 1... = Push: Set
        .... .... .0.. = Reset: Not set
        .... .... ..0. = Syn: Not set
        .... .... ...0 = Fin: Not set
        [TCP Flags: ·······AP···]
    Window size value: 2048
    [Calculated window size: 2048]
    [Window size scaling factor: -2 (no window scaling used)]
    Checksum: 0xc3a4 [unverified]
    [Checksum Status: Unverified]
    Urgent pointer: 0
    [SEQ/ACK analysis]
        [This is an ACK to the segment in frame: 1631]
        [The RTT to ACK the segment was: 0.001754000 seconds]
        [iRTT: 0.001521000 seconds]
        [Bytes in flight: 567]
        [Bytes sent since last PSH flag: 567]
    [Timestamps]
        [Time since first frame in this TCP stream: 509.407742000 seconds]
        [Time since previous frame in this TCP stream: 0.001754000 seconds]
    TCP payload (567 bytes)
    [PDU Size: 567]
OpcUa Binary Protocol
    Message Type: MSG
    Chunk Type: F
    Message Size: 567
    SecureChannelId: 2
    Security Token Id: 3
    Security Sequence Number: 581
    Security RequestId: 575
    OpcUa Service : Encodeable Object
        TypeId : ExpandedNodeId
            NodeId EncodingMask: Four byte encoded Numeric (0x01)
            NodeId Namespace Index: 0
            NodeId Identifier Numeric: PublishResponse (829)
        PublishResponse
            ResponseHeader: ResponseHeader
                Timestamp: Oct 16, 2018 11:43:38.485000000 Mitteleuropäische Sommerzeit
                RequestHandle: 1000573
                ServiceResult: 0x00000000 [Good]
                ServiceDiagnostics: DiagnosticInfo
                    EncodingMask: 0x00
                        .... ...0 = has symbolic id: False
                        .... ..0. = has namespace: False
                        .... .0.. = has localizedtext: False
                        .... 0... = has locale: False
                        ...0 .... = has additional info: False
                        ..0. .... = has inner statuscode: False
                        .0.. .... = has inner diagnostic info: False
                StringTable: Array of String
                    ArraySize: -1
                AdditionalHeader: ExtensionObject
                    TypeId: ExpandedNodeId
                        EncodingMask: 0x00, EncodingMask: Two byte encoded Numeric
                            .... 0000 = EncodingMask: Two byte encoded Numeric (0x0)
                            .0.. .... = has server index: False
                            0... .... = has namespace uri: False
                        Identifier Numeric: 0
                    EncodingMask: 0x00
                        .... ...0 = has binary body: False
                        .... ..0. = has xml body: False
            SubscriptionId: 2
            AvailableSequenceNumbers: Array of UInt32
                ArraySize: 1
                [0]: AvailableSequenceNumbers: 1
            MoreNotifications: False
            NotificationMessage: NotificationMessage
                SequenceNumber: 1
                PublishTime: Oct 16, 2018 11:43:38.485000000 Mitteleuropäische Sommerzeit
                NotificationData: Array of ExtensionObject
                    ArraySize: 1
                    [0]: ExtensionObject
                        TypeId: ExpandedNodeId
                            EncodingMask: 0x01, EncodingMask: Four byte encoded Numeric
                                .... 0001 = EncodingMask: Four byte encoded Numeric (0x1)
                                .0.. .... = has server index: False
                                0... .... = has namespace uri: False
                            Namespace Index: 0
                            Identifier Numeric: 916
                        EncodingMask: 0x01, has binary body
                            .... ...1 = has binary body: True
                            .... ..0. = has xml body: False
                        EventNotificationList: EventNotificationList
                            Events: Array of EventFieldList
                                ArraySize: 5
                                [0]: EventFieldList
                                    ClientHandle: 16
                                    EventFields: Array of Variant
                                        ArraySize: 1
                                        [0]: Variant
                                            Variant Type: NodeId (0x11)
                                            Value: NodeId
                                                .... 0001 = EncodingMask: Four byte encoded Numeric (0x1)
                                                Namespace Index: 0
                                                Identifier Numeric: 4035
                                [1]: EventFieldList
                                    ClientHandle: 16
                                    EventFields: Array of Variant
                                        ArraySize: 19
                                        [0]: Variant
                                            Variant Type: ByteString (0x0f)
                                            ByteString: 19aa9cc82ca68ab4f67fd7fdb4cb3c73
                                        [1]: Variant
                                            Variant Type: NodeId (0x11)
                                            Value: NodeId
                                                .... 0001 = EncodingMask: Four byte encoded Numeric (0x1)
                                                Namespace Index: 0
                                                Identifier Numeric: 52405
                                        [2]: Variant
                                            Variant Type: String (0x0c)
                                            String: Server
                                        [3]: Variant
                                            Variant Type: DateTime (0x0d)
                                            DateTime: Oct 16, 2018 11:43:37.930000000 Mitteleuropäische Sommerzeit
                                        [4]: Variant
                                            Variant Type: LocalizedText (0x15)
                                            Value: LocalizedText
                                                EncodingMask: 0x03, has locale information, has text
                                                    .... ...1 = has locale information: True
                                                    .... ..1. = has text: True
                                                Locale: en-US
                                                Text: An event has been generated.
                                        [5]: Variant
                                            Variant Type: UInt16 (0x05)
                                            UInt16: 100
                                        [6]: Variant
                                            Variant Type: Null (0x00)
                                        [7]: Variant
                                            Variant Type: Null (0x00)
                                        [8]: Variant
                                            Variant Type: Null (0x00)
                                        [9]: Variant
                                            Variant Type: Null (0x00)
                                        [10]: Variant
                                            Variant Type: Null (0x00)
                                        [11]: Variant
                                            Variant Type: Null (0x00)
                                        [12]: Variant
                                            Variant Type: Null (0x00)
                                        [13]: Variant
                                            Variant Type: Null (0x00)
                                        [14]: Variant
                                            Variant Type: Null (0x00)
                                        [15]: Variant
                                            Variant Type: Null (0x00)
                                        [16]: Variant
                                            Variant Type: Null (0x00)
                                        [17]: Variant
                                            Variant Type: Null (0x00)
                                        [18]: Variant
                                            Variant Type: Null (0x00)
                                [2]: EventFieldList
                                    ClientHandle: 16
                                    EventFields: Array of Variant
                                        ArraySize: 19
                                        [0]: Variant
                                            Variant Type: ByteString (0x0f)
                                            ByteString: 9db53a20e493f24972e7be3be1de7d17
                                        [1]: Variant
                                            Variant Type: NodeId (0x11)
                                            Value: NodeId
                                                .... 0001 = EncodingMask: Four byte encoded Numeric (0x1)
                                                Namespace Index: 0
                                                Identifier Numeric: 52405
                                        [2]: Variant
                                            Variant Type: String (0x0c)
                                            String: Server
                                        [3]: Variant
                                            Variant Type: DateTime (0x0d)
                                            DateTime: Oct 16, 2018 11:43:38.098000000 Mitteleuropäische Sommerzeit
                                        [4]: Variant
                                            Variant Type: LocalizedText (0x15)
                                            Value: LocalizedText
                                                EncodingMask: 0x03, has locale information, has text
                                                    .... ...1 = has locale information: True
                                                    .... ..1. = has text: True
                                                Locale: en-US
                                                Text: An event has been generated.
                                        [5]: Variant
                                            Variant Type: UInt16 (0x05)
                                            UInt16: 100
                                        [6]: Variant
                                            Variant Type: Null (0x00)
                                        [7]: Variant
                                            Variant Type: Null (0x00)
                                        [8]: Variant
                                            Variant Type: Null (0x00)
                                        [9]: Variant
                                            Variant Type: Null (0x00)
                                        [10]: Variant
                                            Variant Type: Null (0x00)
                                        [11]: Variant
                                            Variant Type: Null (0x00)
                                        [12]: Variant
                                            Variant Type: Null (0x00)
                                        [13]: Variant
                                            Variant Type: Null (0x00)
                                        [14]: Variant
                                            Variant Type: Null (0x00)
                                        [15]: Variant
                                            Variant Type: Null (0x00)
                                        [16]: Variant
                                            Variant Type: Null (0x00)
                                        [17]: Variant
                                            Variant Type: Null (0x00)
                                        [18]: Variant
                                            Variant Type: Null (0x00)
                                [3]: EventFieldList
                                    ClientHandle: 16
                                    EventFields: Array of Variant
                                        ArraySize: 19
                                        [0]: Variant
                                            Variant Type: ByteString (0x0f)
                                            ByteString: 80fdadede29edcb3cf8c38a3113193f9
                                        [1]: Variant
                                            Variant Type: NodeId (0x11)
                                            Value: NodeId
                                                .... 0001 = EncodingMask: Four byte encoded Numeric (0x1)
                                                Namespace Index: 0
                                                Identifier Numeric: 52405
                                        [2]: Variant
                                            Variant Type: String (0x0c)
                                            String: Server
                                        [3]: Variant
                                            Variant Type: DateTime (0x0d)
                                            DateTime: Oct 16, 2018 11:43:38.267000000 Mitteleuropäische Sommerzeit
                                        [4]: Variant
                                            Variant Type: LocalizedText (0x15)
                                            Value: LocalizedText
                                                EncodingMask: 0x03, has locale information, has text
                                                    .... ...1 = has locale information: True
                                                    .... ..1. = has text: True
                                                Locale: en-US
                                                Text: An event has been generated.
                                        [5]: Variant
                                            Variant Type: UInt16 (0x05)
                                            UInt16: 100
                                        [6]: Variant
                                            Variant Type: Null (0x00)
                                        [7]: Variant
                                            Variant Type: Null (0x00)
                                        [8]: Variant
                                            Variant Type: Null (0x00)
                                        [9]: Variant
                                            Variant Type: Null (0x00)
                                        [10]: Variant
                                            Variant Type: Null (0x00)
                                        [11]: Variant
                                            Variant Type: Null (0x00)
                                        [12]: Variant
                                            Variant Type: Null (0x00)
                                        [13]: Variant
                                            Variant Type: Null (0x00)
                                        [14]: Variant
                                            Variant Type: Null (0x00)
                                        [15]: Variant
                                            Variant Type: Null (0x00)
                                        [16]: Variant
                                            Variant Type: Null (0x00)
                                        [17]: Variant
                                            Variant Type: Null (0x00)
                                        [18]: Variant
                                            Variant Type: Null (0x00)
                                [4]: EventFieldList
                                    ClientHandle: 16
                                    EventFields: Array of Variant
                                        ArraySize: 19
                                        [0]: Variant
                                            Variant Type: ByteString (0x0f)
                                            ByteString: 4eed42378c0d4bc7ec1ed13ddabdfb1f
                                        [1]: Variant
                                            Variant Type: NodeId (0x11)
                                            Value: NodeId
                                                .... 0001 = EncodingMask: Four byte encoded Numeric (0x1)
                                                Namespace Index: 0
                                                Identifier Numeric: 52405
                                        [2]: Variant
                                            Variant Type: String (0x0c)
                                            String: Server
                                        [3]: Variant
                                            Variant Type: DateTime (0x0d)
                                            DateTime: Oct 16, 2018 11:43:38.437000000 Mitteleuropäische Sommerzeit
                                        [4]: Variant
                                            Variant Type: LocalizedText (0x15)
                                            Value: LocalizedText
                                                EncodingMask: 0x03, has locale information, has text
                                                    .... ...1 = has locale information: True
                                                    .... ..1. = has text: True
                                                Locale: en-US
                                                Text: An event has been generated.
                                        [5]: Variant
                                            Variant Type: UInt16 (0x05)
                                            UInt16: 100
                                        [6]: Variant
                                            Variant Type: Null (0x00)
                                        [7]: Variant
                                            Variant Type: Null (0x00)
                                        [8]: Variant
                                            Variant Type: Null (0x00)
                                        [9]: Variant
                                            Variant Type: Null (0x00)
                                        [10]: Variant
                                            Variant Type: Null (0x00)
                                        [11]: Variant
                                            Variant Type: Null (0x00)
                                        [12]: Variant
                                            Variant Type: Null (0x00)
                                        [13]: Variant
                                            Variant Type: Null (0x00)
                                        [14]: Variant
                                            Variant Type: Null (0x00)
                                        [15]: Variant
                                            Variant Type: Null (0x00)
                                        [16]: Variant
                                            Variant Type: Null (0x00)
                                        [17]: Variant
                                            Variant Type: Null (0x00)
                                        [18]: Variant
                                            Variant Type: Null (0x00)
            Results: Array of StatusCode
                ArraySize: -1
            DiagnosticInfos: Array of DiagnosticInfo
                ArraySize: -1

```

9) When calling the function for the second time, there is no response because the server crashes. The same when changing the filter, there is no response after ModifyMonitoredItemsRequest.

**Comment by sqadasi** [comment]
@aDogCalledSpot ,I tested further and noticed the following: 
1) when changing the max MonitoredItem queue size from 1 to a number greater than the number of fired events, then it works without triggering the overflow event. (**so it could be the fix for this issue**)

2) However, when leaving max MonitoredItem queue size = 1, and triggering only one event at time with one method call (like in the toturial, but event nodes won't be deleted after triggering the event) there are two results:
a) when calling the method successively in a slow manner, no overflow event is generated.
b) when calling the method successively in a fast manner, the overflow event is generated and the server crashes (fails in the mentioned assert).
I thought it maybe dependent on the sampling interval, but setting it to a low value (5ms) in server and client won't help.

What could be the cause of this behaviour?

**Comment by aDogCalledSpot** [comment]
I'm still having trouble reproducing the issue. Have you tried this with an own client? 

Could you send me your full code for the server, just to be sure nothing's missing.

**Comment by sqadasi** [comment]
@aDogCalledSpot thank you for responding, Ari!
I am using an embedded device as server with own operating system, therefore think it won't help sending you the code...
However, I have tested further, this time with default server configuration and could reproduce the error (so I think you too could reproduce the error this way :))
1) change the monitoredItem queue size limits range to (1, 1) or other small value so you can generate the overflow event in
https://github.com/open62541/open62541/blob/e229a3514a79edba15ecd5abcb9dbca99fcfaf49/plugins/ua_config_default.c#L275

2) use the toturial code provided in my first comment to generate multiple events
https://github.com/open62541/open62541/issues/2114#issue-370234772

3) first time calling the generating method, an overflow event will be generated plus a number of (queueSize - 1) normal events

4) second time calling the generating method will crash the server

I checked the function 
https://github.com/open62541/open62541/blob/e229a3514a79edba15ecd5abcb9dbca99fcfaf49/src/server/ua_subscription_monitoreditem.c#L234
and found that the check in 
https://github.com/open62541/open62541/blob/e229a3514a79edba15ecd5abcb9dbca99fcfaf49/src/server/ua_subscription_monitoreditem.c#L235
is rather strange when we have an overflow event, because we could get very large values resulting from "mon->queueSize - mon->eventOverflows", for example when we have 2 Overflows from the first call and the queueSize is 1 from the second call.

As an Idea, I thought I could reset the the overflow event value of the monitoredItem (mon->eventOverflows = 0; ) when dequeuing the events (at the end of the function):
https://github.com/open62541/open62541/blob/e229a3514a79edba15ecd5abcb9dbca99fcfaf49/src/server/ua_subscription_monitoreditem.c#L105

With that change, when the queue size is small, then an overflow event will be generated plus a number of (queueSize) normal events. However the server won't crash on multiple calls. 

I would like to ask, whether this behaviour is correct, or should we never get more events (including the overflow event) than the queue size?

**Comment by RFil** [comment]
Try compiling with UA_MULTITHREADING=100

**Comment by teccheck** [comment]
This functionality has been tested over multiple years via CI and CTT, so it should work now. As there's been no recent activity, I'll close this
